{
  "kind": "descriptor_ref",
  "valid": true,
  "descriptor_ref": "easynet:///r/example/ability/device.dev-a.observe.health@1.0.0",
  "ability_ura": "easynet:///r/example/ability/device.dev-a.observe.health",
  "descriptor_version": "1.0.0",
  "profile": "easynet-strict-v2",
  "components": {
    "owner_ura": "easynet:///r/example/device/dev-a",
    "owner_kind": "device",
    "public_name": "observe.health",
    "local_registry_ability": "observe.health"
  },
  "metadata": {
    "grammar_owner": "axon",
    "source": "fixture"
  }
}
